### ISSUE TITLE
labels extraction not seem to be working

### ISSUE THREAD

**Issue by MichaelMayorov** [carlpett/stream_exporter#6]
Hi!

I got following stream_exporter.yaml

```
metrics:
  - name: pdu_connection_est
    kind: counter
    pattern: "Communications established"
  - name: pdu_connection_lost
    kind: counter
    pattern: "(?P<ip>[0-9]+.[0-9]+.[0-9]+.[0-9]+).*Communications lost"
```

Way to start
```
./stream_exporter -input.type syslog -input.syslog.listenaddr 0.0.0.0:9999 -input.syslog.listenfamily udp
```

My go verison:
```
go version go1.9.2 linux/amd64
```

Data sample
```
14:27:37.444626 IP 192.168.10.188.52234 > 192.168.11.142.9999: UDP, length 73
E..e.5..@.....
......
'..Q..<8>Feb 16 14:10:01 192.168.10.188 Switched Rack PDU: Communications lost.
```

The problem is that metric pdu_connection_lost didn't appear in /metrics page
```
# HELP pdu_connection_est pdu_connection_est
# TYPE pdu_connection_est counter
pdu_connection_est 0
stream_exporter_line_processing_duration_seconds_bucket{metric="pdu_connection_est",le="1e-06"} 0
stream_exporter_line_processing_duration_seconds_bucket{metric="pdu_connection_est",le="3.981072e-06"} 0
stream_exporter_line_processing_duration_seconds_bucket{metric="pdu_connection_est",le="1.5848934269184e-05"} 0
stream_exporter_line_processing_duration_seconds_bucket{metric="pdu_connection_est",le="6.309574844888889e-05"} 2
stream_exporter_line_processing_duration_seconds_bucket{metric="pdu_connection_est",le="0.000251188717468915"} 2
stream_exporter_line_processing_duration_seconds_bucket{metric="pdu_connection_est",le="+Inf"} 2
stream_exporter_line_processing_duration_seconds_sum{metric="pdu_connection_est"} 8.153e-05
stream_exporter_line_processing_duration_seconds_count{metric="pdu_connection_est"} 2
stream_exporter_line_processing_duration_seconds_bucket{metric="pdu_connection_lost",le="1e-06"} 0
stream_exporter_line_processing_duration_seconds_bucket{metric="pdu_connection_lost",le="3.981072e-06"} 0
stream_exporter_line_processing_duration_seconds_bucket{metric="pdu_connection_lost",le="1.5848934269184e-05"} 0
stream_exporter_line_processing_duration_seconds_bucket{metric="pdu_connection_lost",le="6.309574844888889e-05"} 2
stream_exporter_line_processing_duration_seconds_bucket{metric="pdu_connection_lost",le="0.000251188717468915"} 2
stream_exporter_line_processing_duration_seconds_bucket{metric="pdu_connection_lost",le="+Inf"} 2
stream_exporter_line_processing_duration_seconds_sum{metric="pdu_connection_lost"} 0.000107829
stream_exporter_line_processing_duration_seconds_count{metric="pdu_connection_lost"} 2
```

I tried different types of regular expressions, but still no difference.

**Comment by carlpett** [comment]
Hi!
Thanks for reporting!
I would guess this happens due to different versions of the syslog messages. It seems the syslog messages is not normalized the way I thought by the library I'm using. 
Only the body of the log is passed to the parser. However, the name of field carrying the body differs with the different implementations, so for rfc3164, the name is `content`, while it is `message` for rfc5424...
As a workaround, if you can get your syslog client to send messages in rfc3164 format, that should work. I'll try to come up with a patch that fixes the underlying issue.

**Comment by MichaelMayorov** [comment]
Hm, well. As far as I can see it's already in rfc3164(I personally don't much familiar with this RFC, but log samples in Examples section looks pretty close to sample I see in my tcpdump).

**Comment by carlpett** [comment]
Hm, ok, that is odd then... In my testing with your configuration and sample data, it worked fine when I forced the logger to use rfc3164, but not otherwise. 
Could you try the attached version? That should both handle the different versions better, as well as give some log output if it cannot figure it out.
[stream_exporter.zip](https://github.com/carlpett/stream_exporter/files/1731542/issue-6.zip)

**Comment by MichaelMayorov** [comment]
Thanks!

I tried to poke in your stream_exporter binary with forced rfc3164, here it goes:

```
./stream_exporter -input.type syslog -input.syslog.listenaddr 0.0.0.0:9999 -input.syslog.listenfamily udp -input.syslog.format rfc3164 -log.level debug
INFO[0000] Syslog server started listening at 0.0.0.0:9999  source="syslog.go:91"
INFO[0000] Serving metrics on :9178/metrics              source="exporter.go:116"
```
BTW, I didn't see any additional output. Here md5sum just in case 
```
md5sum stream_exporter
baaaa2cd1eb2e645c3d35480a902c6eb  stream_exporter
```

Unfortunately, I didn't see any changes. May be you interesting - before poking into socket /metric looks like:

```
curl -s localhost:9178/metrics | grep pdu
# HELP pdu_connection_est pdu_connection_est
# TYPE pdu_connection_est counter
pdu_connection_est 0
```

After sending ```<8>Feb 16 16:44:47 192.168.10.188 Switched Rack PDU: Communications lost.``` it changed to

```
 curl -s localhost:9178/metrics | grep pdu
# HELP pdu_connection_est pdu_connection_est
# TYPE pdu_connection_est counter
pdu_connection_est 0
stream_exporter_line_processing_duration_seconds_bucket{metric="pdu_connection_est",le="1e-06"} 0
stream_exporter_line_processing_duration_seconds_bucket{metric="pdu_connection_est",le="3.981072e-06"} 0
stream_exporter_line_processing_duration_seconds_bucket{metric="pdu_connection_est",le="1.5848934269184e-05"} 0
stream_exporter_line_processing_duration_seconds_bucket{metric="pdu_connection_est",le="6.309574844888889e-05"} 1
stream_exporter_line_processing_duration_seconds_bucket{metric="pdu_connection_est",le="0.000251188717468915"} 1
stream_exporter_line_processing_duration_seconds_bucket{metric="pdu_connection_est",le="+Inf"} 1
stream_exporter_line_processing_duration_seconds_sum{metric="pdu_connection_est"} 5.2645e-05
stream_exporter_line_processing_duration_seconds_count{metric="pdu_connection_est"} 1
stream_exporter_line_processing_duration_seconds_bucket{metric="pdu_connection_lost",le="1e-06"} 0
stream_exporter_line_processing_duration_seconds_bucket{metric="pdu_connection_lost",le="3.981072e-06"} 0
stream_exporter_line_processing_duration_seconds_bucket{metric="pdu_connection_lost",le="1.5848934269184e-05"} 0
stream_exporter_line_processing_duration_seconds_bucket{metric="pdu_connection_lost",le="6.309574844888889e-05"} 1
stream_exporter_line_processing_duration_seconds_bucket{metric="pdu_connection_lost",le="0.000251188717468915"} 1
stream_exporter_line_processing_duration_seconds_bucket{metric="pdu_connection_lost",le="+Inf"} 1
stream_exporter_line_processing_duration_seconds_sum{metric="pdu_connection_lost"} 6.3073e-05
stream_exporter_line_processing_duration_seconds_count{metric="pdu_connection_lost"} 1
```

**Comment by MichaelMayorov** [comment]
BTW, it may be interesting to view in hexdump of my query:

```
17:18:35.447220 IP 192.168.10.188.52234 > 192.168.11.142.9999: UDP, length 73
	0x0000:  4500 0065 0047 0000 4011 e2a6 c0a8 0abc  E..e.G..@.......
	0x0010:  c0a8 0b8e cc0a 270f 0051 0000 3c38 3e46  ......'..Q..<8>F
	0x0020:  6562 2031 3620 3137 3a30 303a 3539 2031  eb.16.17:00:59.1
	0x0030:  3932 2e31 3638 2e31 302e 3138 3820 5377  92.168.10.188.Sw
	0x0040:  6974 6368 6564 2052 6163 6b20 5044 553a  itched.Rack.PDU:
	0x0050:  2043 6f6d 6d75 6e69 6361 7469 6f6e 7320  .Communications.
	0x0060:  6c6f 7374 2e                             lost.
```

**Comment by carlpett** [comment]
Ok, so if there was no output, then it should at least have been recognized (I only added logging if neither the `content` (rfc3164) or `message` (rfc5424) fields were set). 
Let's add some more logging then... New binary attached!
[stream_exporter.zip](https://github.com/carlpett/stream_exporter/files/1731709/issue-6.zip)

**Comment by MichaelMayorov** [comment]
Start sequence is the same, no difference in output... Here is /metric after few tries, still no difference :(

```
curl -s localhost:9178/metrics | grep '^[^#]'
go_gc_duration_seconds{quantile="0"} 0
go_gc_duration_seconds{quantile="0.25"} 0
go_gc_duration_seconds{quantile="0.5"} 0
go_gc_duration_seconds{quantile="0.75"} 0
go_gc_duration_seconds{quantile="1"} 0
go_gc_duration_seconds_sum 0
go_gc_duration_seconds_count 0
go_goroutines 17
go_memstats_alloc_bytes 1.095968e+06
go_memstats_alloc_bytes_total 1.095968e+06
go_memstats_buck_hash_sys_bytes 1.443044e+06
go_memstats_frees_total 989
go_memstats_gc_sys_bytes 169984
go_memstats_heap_alloc_bytes 1.095968e+06
go_memstats_heap_idle_bytes 770048
go_memstats_heap_inuse_bytes 1.851392e+06
go_memstats_heap_objects 10510
go_memstats_heap_released_bytes_total 0
go_memstats_heap_sys_bytes 2.62144e+06
go_memstats_last_gc_time_seconds 0
go_memstats_lookups_total 62
go_memstats_mallocs_total 11499
go_memstats_mcache_inuse_bytes 6944
go_memstats_mcache_sys_bytes 16384
go_memstats_mspan_inuse_bytes 30704
go_memstats_mspan_sys_bytes 32768
go_memstats_next_gc_bytes 4.473924e+06
go_memstats_other_sys_bytes 797716
go_memstats_stack_inuse_bytes 524288
go_memstats_stack_sys_bytes 524288
go_memstats_sys_bytes 5.605624e+06
pdu_connection_est 0
process_cpu_seconds_total 0.02
process_max_fds 1024
process_open_fds 8
process_resident_memory_bytes 1.0850304e+07
process_start_time_seconds 1.51879300124e+09
process_virtual_memory_bytes 2.20758016e+08
stream_exporter_build_info{branch="",goversion="go1.9.2",revision="",version=""} 1
stream_exporter_line_processing_lines_total 0
```

**Comment by carlpett** [comment]
Hm, you should be getting log output for each syslog message that is processed now... Also, seems odd that `stream_exporter_line_processing_lines_total` is still zero after a few tries (it hasn't been in your previous dumps). Are you sure that you are sending your test data to the right place?

**Comment by MichaelMayorov** [comment]
Oh, my bad. I played with tcp/udp and forgot to switch back to udp. Here it is:
```
./stream_exporter -input.type syslog -input.syslog.listenaddr 0.0.0.0:9999 -input.syslog.listenfamily udp -input.syslog.format rfc3164 -log.level debug
INFO[0000] Serving metrics on :9178/metrics              source="exporter.go:116"
INFO[0000] Syslog server started listening at 0.0.0.0:9999  source="syslog.go:91"
INFO[0006] Processing syslog RFC-3164 message with content='Rack PDU: Communications lost.'
  source="syslog.go:96"
INFO[0063] Processing syslog RFC-3164 message with content='Rack PDU: Communications lost.'
  source="syslog.go:96"
```

And /metrics
```
curl -s localhost:9178/metrics | grep pdu
# HELP pdu_connection_est pdu_connection_est
# TYPE pdu_connection_est counter
pdu_connection_est 0
stream_exporter_line_processing_duration_seconds_bucket{metric="pdu_connection_est",le="1e-06"} 0
stream_exporter_line_processing_duration_seconds_bucket{metric="pdu_connection_est",le="3.981072e-06"} 0
stream_exporter_line_processing_duration_seconds_bucket{metric="pdu_connection_est",le="1.5848934269184e-05"} 0
stream_exporter_line_processing_duration_seconds_bucket{metric="pdu_connection_est",le="6.309574844888889e-05"} 1
stream_exporter_line_processing_duration_seconds_bucket{metric="pdu_connection_est",le="0.000251188717468915"} 2
stream_exporter_line_processing_duration_seconds_bucket{metric="pdu_connection_est",le="+Inf"} 2
stream_exporter_line_processing_duration_seconds_sum{metric="pdu_connection_est"} 9.9734e-05
stream_exporter_line_processing_duration_seconds_count{metric="pdu_connection_est"} 2
stream_exporter_line_processing_duration_seconds_bucket{metric="pdu_connection_lost",le="1e-06"} 0
stream_exporter_line_processing_duration_seconds_bucket{metric="pdu_connection_lost",le="3.981072e-06"} 0
stream_exporter_line_processing_duration_seconds_bucket{metric="pdu_connection_lost",le="1.5848934269184e-05"} 0
stream_exporter_line_processing_duration_seconds_bucket{metric="pdu_connection_lost",le="6.309574844888889e-05"} 1
stream_exporter_line_processing_duration_seconds_bucket{metric="pdu_connection_lost",le="0.000251188717468915"} 2
stream_exporter_line_processing_duration_seconds_bucket{metric="pdu_connection_lost",le="+Inf"} 2
stream_exporter_line_processing_duration_seconds_sum{metric="pdu_connection_lost"} 0.000104533
stream_exporter_line_processing_duration_seconds_count{metric="pdu_connection_lost"} 2
```

**Comment by MichaelMayorov** [comment]
It seems weird that I didn't see an IP address here... I tried to specify one as part of the message and that what I saw:
```
./stream_exporter -input.type syslog -input.syslog.listenaddr 0.0.0.0:9999 -input.syslog.listenfamily udp -input.syslog.format rfc3164 -log.level debug
INFO[0000] Serving metrics on :9178/metrics              source="exporter.go:116"
INFO[0000] Syslog server started listening at 0.0.0.0:9999  source="syslog.go:91"
INFO[0002] Processing syslog RFC-3164 message with content='witched Rack PDU: Communications lost.'
  source="syslog.go:96"
```

And here is message I sent from my PDU:

```
18:52:27.471541 IP 192.168.10.188.52234 > 192.168.11.142.9999: UDP, length 84
E..p.b..@.....
......
'..\..<8>Feb 16 18:34:51 192.168.10.188 192.168.1.1 witched Rack PDU: Communications lost.
```

Maybe is there an issue in underlying syslog message parser?

**Comment by MichaelMayorov** [comment]
I tried to dig in stream_exporter guts and insert print to see how message from syslog server looks like:
input/syslog.go
```
 93 ····go func(lineIn syslog.LogPartsChannel) {
 94 ········for parts := range lineIn {
 95             log.Infof("%v", parts)
 96 ············ch <- fmt.Sprintf("%v", parts["content"])
 97 ············/* parts is a map with the following keys:
 98 ············-hostname
 99 ············-tag
...
```

Here is message itself

```
INFO[0017] map[content:witched Rack PDU: Communications lost. priority:8 severity:0 client:192.168.10.188:52234 tls_peer: hostname:192.168.10.188 tag:192.168.1.1 timestamp:2018-02-16 19:28:02 +0000 UTC facility:1]  source="syslog.go:95"
```

Sorry, if it looks ugly I'm not very familiar with go syntax :(

I think it would be great if stream_exporter made prometheus label from "client" filed by default, because obviously one always want to know who sent a message to log server.

**Comment by MichaelMayorov** [comment]
I was able to fix my problem by addind "hostname" field to syslog server output

```
--- a/input/syslog.go
+++ b/input/syslog.go
@@ -92,7 +92,7 @@ func (input SyslogInput) StartStream(ch chan<- string) {

        go func(lineIn syslog.LogPartsChannel) {
                for parts := range lineIn {
-                       ch <- fmt.Sprintf("%v", parts["content"])
+                       ch <- fmt.Sprintf("%v %v", parts["hostname"], parts["content"])
                        /* parts is a map with the following keys:
                        -hostname
                        -tag
```

I could make a PR if you'd like.

**Comment by carlpett** [comment]
Ah, it was not part of the message - that explains it not matching :) I misunderstood the original post then - I thought the tcpdump format was what you actually syslog:ed...
So, as you might have seen in the comments there, there should be _some_ way to choose the fields you want, but I wasn't sure what people would want. Would a format-string be good for you, or do you have other ideas for how it'd be most useful for you?
Simply adding the client is probably not good enough, generally, since a lot of people redirect to it via rules on the local machine.

**Comment by MichaelMayorov** [comment]
Well, speaking of problem I'm trying to solve. We have a bunch of APC rack-mount PDUs which we trying to monitor. The only SNMP monitoring wasn't enough since it not show all events happening in system, such as continuous messages about reestablishing connection between internal PDU NMC and hardware monitoring which could indicate a failure inside PDU.

My point is to extract a log severity number(since we don't know what else messages PDU could send to us) and IP address(or hostname). That should be enough to find a problem PDU and set up monitoring.

**Comment by MichaelMayorov** [comment]
```
diff --git a/input/syslog.go b/input/syslog.go
index 90d1f4e..eb07b5c 100644
--- a/input/syslog.go
+++ b/input/syslog.go
@@ -92,7 +92,7 @@ func (input SyslogInput) StartStream(ch chan<- string) {

        go func(lineIn syslog.LogPartsChannel) {
                for parts := range lineIn {
-                       ch <- fmt.Sprintf("%v", parts["content"])
+                       ch <- fmt.Sprintf("%v %v %v", parts["severity"], parts["hostname"], parts["content"])
                        /* parts is a map with the following keys:
                        -hostname
                        -tag
```

This patch completely satisfies me, looks crappy though. I'd suggest to pass whole syslog line as it is - in one string. It's more convenient and predictable for user which wants to take control over all fields of log line.

**Comment by carlpett** [comment]
Ok, thanks for the explanation of your use-case! I cannot remember the exact reason now, but there was some weird things in the full syslog line that was why I initially just supplied the body part. 
I'll have to dig into it again and see if I can find out what it was. Otherwise, I agree that getting the full data is best.
